{
  "config": {
    "component_audit_path": "reports/dfl_candidate_component_audit_2026-10-12.json",
    "exclude_transitively_protected": true,
    "input_path": "data/processed/dfl_positive_candidates_2026_10_12.jsonl",
    "k_values": [
      3,
      4,
      5
    ],
    "max_reported_patterns": 100,
    "max_span_length": 100,
    "min_span_length": 5,
    "minimum_distinct_proteins": 3,
    "permutations": 2000,
    "purpose": "exploratory_sequence_pattern_discovery_not_function_assignment_or_detector_training",
    "schema_version": "0.1.0",
    "seed": 20261012
  },
  "counts": {
    "excluded_protected_similarity_review": 52,
    "included_proteins": 146,
    "included_spans": 175,
    "patterns_with_bh_q_below_0_05": 4,
    "source_proteins": 205,
    "tested_patterns": 387
  },
  "input": {
    "path": "data/processed/dfl_positive_candidates_2026_10_12.jsonl",
    "source_type": "DisProt 2026_06 curated flexible-linker positive regions, NOT SynLinker"
  },
  "limitations": [
    "This pilot uses DisProt positives, not the unavailable original SynLinker row-level collection.",
    "The component screen is not full homology or domain-family clearance.",
    "Composition-preserving shuffles are a null control, not verified non-linker negatives.",
    "Patterns were selected for minimum observed support before BH adjustment, so q-values are descriptive and not confirmatory FDR guarantees.",
    "Exact short patterns can reflect low complexity or shared ancestry; no geometric or biochemical function is inferred.",
    "Data are not a fresh external benchmark and no detector is trained here."
  ],
  "patterns": [
    {
      "bh_q": 0.04835082458770615,
      "empirical_p": 0.0004997501249375312,
      "length": 3,
      "null_mean_proteins": 1.002,
      "observed_proteins": 6,
      "protein_ids": [
        "DP01877",
        "DP03069",
        "DP03222",
        "DP03541",
        "DP03792",
        "DP04491"
      ],
      "sequence_pattern": "IGS"
    },
    {
      "bh_q": 0.04835082458770615,
      "empirical_p": 0.0004997501249375312,
      "length": 3,
      "null_mean_proteins": 0.318,
      "observed_proteins": 4,
      "protein_ids": [
        "DP02587",
        "DP02756",
        "DP02945",
        "DP03221"
      ],
      "sequence_pattern": "LDM"
    },
    {
      "bh_q": 0.04835082458770615,
      "empirical_p": 0.0004997501249375312,
      "length": 4,
      "null_mean_proteins": 0.051,
      "observed_proteins": 3,
      "protein_ids": [
        "DP02892",
        "DP03410",
        "DP03606"
      ],
      "sequence_pattern": "ADTI"
    },
    {
      "bh_q": 0.04835082458770615,
      "empirical_p": 0.0004997501249375312,
      "length": 4,
      "null_mean_proteins": 0.115,
      "observed_proteins": 3,
      "protein_ids": [
        "DP03389",
        "DP03400",
        "DP04466"
      ],
      "sequence_pattern": "SIKK"
    },
    {
      "bh_q": 0.05525808524309274,
      "empirical_p": 0.0009995002498750624,
      "length": 4,
      "null_mean_proteins": 0.495,
      "observed_proteins": 4,
      "protein_ids": [
        "DP02398",
        "DP02896",
        "DP03499",
        "DP03747"
      ],
      "sequence_pattern": "EESE"
    },
    {
      "bh_q": 0.05525808524309274,
      "empirical_p": 0.0009995002498750624,
      "length": 4,
      "null_mean_proteins": 0.154,
      "observed_proteins": 3,
      "protein_ids": [
        "DP01857",
        "DP02398",
        "DP03499"
      ],
      "sequence_pattern": "APGQ"
    },
    {
      "bh_q": 0.05525808524309274,
      "empirical_p": 0.0009995002498750624,
      "length": 3,
      "null_mean_proteins": 0.13,
      "observed_proteins": 3,
      "protein_ids": [
        "DP02931",
        "DP03057",
        "DP03337"
      ],
      "sequence_pattern": "RAW"
    },
    {
      "bh_q": 0.05802098950524738,
      "empirical_p": 0.0014992503748125937,
      "length": 3,
      "null_mean_proteins": 1.338,
      "observed_proteins": 6,
      "protein_ids": [
        "DP01857",
        "DP02896",
        "DP03069",
        "DP03410",
        "DP03547",
        "DP04643"
      ],
      "sequence_pattern": "GPV"
    },
    {
      "bh_q": 0.05802098950524738,
      "empirical_p": 0.0014992503748125937,
      "length": 4,
      "null_mean_proteins": 0.305,
      "observed_proteins": 3,
      "protein_ids": [
        "DP02398",
        "DP03400",
        "DP03499"
      ],
      "sequence_pattern": "GEES"
    },
    {
      "bh_q": 0.05802098950524738,
      "empirical_p": 0.0014992503748125937,
      "length": 3,
      "null_mean_proteins": 0.273,
      "observed_proteins": 3,
      "protein_ids": [
        "DP02567",
        "DP03337",
        "DP03410"
      ],
      "sequence_pattern": "RLF"
    },
    {
      "bh_q": 0.11819090454772614,
      "empirical_p": 0.005497251374312844,
      "length": 3,
      "null_mean_proteins": 1.712,
      "observed_proteins": 6,
      "protein_ids": [
        "DP02612",
        "DP02931",
        "DP03100",
        "DP03222",
        "DP03529",
        "DP03589"
      ],
      "sequence_pattern": "AKA"
    },
    {
      "bh_q": 0.11819090454772614,
      "empirical_p": 0.004997501249375313,
      "length": 3,
      "null_mean_proteins": 1.665,
      "observed_proteins": 6,
      "protein_ids": [
        "DP02765",
        "DP03100",
        "DP03221",
        "DP03222",
        "DP03241",
        "DP03410"
      ],
      "sequence_pattern": "DPG"
    },
    {
      "bh_q": 0.11819090454772614,
      "empirical_p": 0.004997501249375313,
      "length": 3,
      "null_mean_proteins": 1.702,
      "observed_proteins": 6,
      "protein_ids": [
        "DP02170",
        "DP02835",
        "DP03162",
        "DP03232",
        "DP03747",
        "DP04086"
      ],
      "sequence_pattern": "EEV"
    },
    {
      "bh_q": 0.11819090454772614,
      "empirical_p": 0.004497751124437781,
      "length": 3,
      "null_mean_proteins": 1.619,
      "observed_proteins": 6,
      "protein_ids": [
        "DP02759",
        "DP02791",
        "DP03230",
        "DP03337",
        "DP03593",
        "DP03747"
      ],
      "sequence_pattern": "GAR"
    },
    {
      "bh_q": 0.11819090454772614,
      "empirical_p": 0.0034982508745627187,
      "length": 3,
      "null_mean_proteins": 1.629,
      "observed_proteins": 6,
      "protein_ids": [
        "DP01429",
        "DP02756",
        "DP03299",
        "DP03389",
        "DP03410",
        "DP04491"
      ],
      "sequence_pattern": "LDE"
    },
    {
      "bh_q": 0.11819090454772614,
      "empirical_p": 0.005497251374312844,
      "length": 4,
      "null_mean_proteins": 0.435,
      "observed_proteins": 3,
      "protein_ids": [
        "DP01817",
        "DP04466",
        "DP04491"
      ],
      "sequence_pattern": "EEEK"
    },
    {
      "bh_q": 0.11819090454772614,
      "empirical_p": 0.004997501249375313,
      "length": 4,
      "null_mean_proteins": 0.333,
      "observed_proteins": 3,
      "protein_ids": [
        "DP01817",
        "DP03100",
        "DP04491"
      ],
      "sequence_pattern": "EEKK"
    },
    {
      "bh_q": 0.11819090454772614,
      "empirical_p": 0.005497251374312844,
      "length": 3,
      "null_mean_proteins": 0.332,
      "observed_proteins": 3,
      "protein_ids": [
        "DP01248",
        "DP02756",
        "DP02805"
      ],
      "sequence_pattern": "PHD"
    },
    {
      "bh_q": 0.12214945158999448,
      "empirical_p": 0.005997001499250375,
      "length": 4,
      "null_mean_proteins": 0.759,
      "observed_proteins": 4,
      "protein_ids": [
        "DP02410",
        "DP02727",
        "DP03065",
        "DP04491"
      ],
      "sequence_pattern": "SSSG"
    },
    {
      "bh_q": 0.12571214392803598,
      "empirical_p": 0.006496751624187906,
      "length": 3,
      "null_mean_proteins": 0.784,
      "observed_proteins": 4,
      "protein_ids": [
        "DP02170",
        "DP02756",
        "DP02805",
        "DP03400"
      ],
      "sequence_pattern": "RKL"
    },
    {
      "bh_q": 0.12613258588097256,
      "empirical_p": 0.0074962518740629685,
      "length": 3,
      "null_mean_proteins": 0.799,
      "observed_proteins": 4,
      "protein_ids": [
        "DP02170",
        "DP02723",
        "DP02791",
        "DP03944"
      ],
      "sequence_pattern": "QRK"
    },
    {
      "bh_q": 0.12613258588097256,
      "empirical_p": 0.0069965017491254375,
      "length": 3,
      "null_mean_proteins": 0.363,
      "observed_proteins": 3,
      "protein_ids": [
        "DP01857",
        "DP02959",
        "DP04461"
      ],
      "sequence_pattern": "LMP"
    },
    {
      "bh_q": 0.12613258588097256,
      "empirical_p": 0.0074962518740629685,
      "length": 4,
      "null_mean_proteins": 0.401,
      "observed_proteins": 3,
      "protein_ids": [
        "DP02833",
        "DP03004",
        "DP03318"
      ],
      "sequence_pattern": "SPAP"
    },
    {
      "bh_q": 0.12645600276784685,
      "empirical_p": 0.0079960019990005,
      "length": 3,
      "null_mean_proteins": 2.252,
      "observed_proteins": 7,
      "protein_ids": [
        "DP02759",
        "DP02828",
        "DP03100",
        "DP04086",
        "DP04305",
        "DP04408",
        "DP04438"
      ],
      "sequence_pattern": "PSK"
    },
    {
      "bh_q": 0.12645600276784685,
      "empirical_p": 0.00849575212393803,
      "length": 3,
      "null_mean_proteins": 0.82,
      "observed_proteins": 4,
      "protein_ids": [
        "DP00226",
        "DP02729",
        "DP03648",
        "DP03944"
      ],
      "sequence_pattern": "LTT"
    },
    {
      "bh_q": 0.12645600276784685,
      "empirical_p": 0.00849575212393803,
      "length": 3,
      "null_mean_proteins": 0.861,
      "observed_proteins": 4,
      "protein_ids": [
        "DP02634",
        "DP02759",
        "DP02836",
        "DP04305"
      ],
      "sequence_pattern": "QKR"
    },
    {
      "bh_q": 0.13609861735798767,